{
  "schema_version": "aon-taxonomy-baseline-v1",
  "taxonomy_version": "v1",
  "node_count": 515,
  "tree_digest": "89962555f76a41af9c2b6d213dd0241c28214d50ec8185af9d2efb0fe28934b2",
  "baseline_digest": "c780b40af38c942b15f4ffead7106eeceb7704f6011c309725934ecd28d2d7c0",
  "nodes": [
    {
      "category_id": "fashion_apparel",
      "name": "Apparel",
      "slug": "fashion_apparel",
      "parent_id": null,
      "level": 1
    },
    {
      "category_id": "fashion_apparel.clothing",
      "name": "Clothing",
      "slug": "clothing",
      "parent_id": "fashion_apparel",
      "level": 2
    },
    {
      "category_id": "fashion_apparel.clothing.children_s_clothing",
      "name": "Children's Clothing",
      "slug": "children_s_clothing",
      "parent_id": "fashion_apparel.clothing",
      "level": 3
    },
    {
      "category_id": "fashion_apparel.clothing.formal_wear",
      "name": "Formal Wear",
      "slug": "formal_wear",
      "parent_id": "fashion_apparel.clothing",
      "level": 3
    },
    {
      "category_id": "fashion_apparel.clothing.men_s_clothing",
      "name": "Men's Clothing",
      "slug": "men_s_clothing",
      "parent_id": "fashion_apparel.clothing",
      "level": 3
    },
    {
      "category_id": "fashion_apparel.clothing.plus_size_clothing",
      "name": "Plus Size Clothing",
      "slug": "plus_size_clothing",
      "parent_id": "fashion_apparel.clothing",
      "level": 3
    },
    {
      "category_id": "fashion_apparel.clothing.shirts_tops_blouses",
      "name": "Shirts, Tops & Blouses",
      "slug": "shirts_tops_blouses",
      "parent_id": "fashion_apparel.clothing",
      "level": 3
    },
    {
      "category_id": "fashion_apparel.clothing.shirts_tops_blouses.jerseys_knit_shirts",
      "name": "Jerseys & Knit Shirts",
      "slug": "jerseys_knit_shirts",
      "parent_id": "fashion_apparel.clothing.shirts_tops_blouses",
      "level": 4
    },
    {
      "category_id": "fashion_apparel.clothing.sleepwear",
      "name": "Sleepwear",
      "slug": "sleepwear",
      "parent_id": "fashion_apparel.clothing",
      "level": 3
    },
    {
      "category_id": "fashion_apparel.clothing.swimwear",
      "name": "Swimwear",
      "slug": "swimwear",
      "parent_id": "fashion_apparel.clothing",
      "level": 3
    },
    {
      "category_id": "fashion_apparel.clothing.underwear",
      "name": "Underwear",
      "slug": "underwear",
      "parent_id": "fashion_apparel.clothing",
      "level": 3
    },
    {
      "category_id": "fashion_apparel.clothing.women_s_clothing",
      "name": "Women's Clothing",
      "slug": "women_s_clothing",
      "parent_id": "fashion_apparel.clothing",
      "level": 3
    },
    {
      "category_id": "fashion_apparel.footwear",
      "name": "Footwear",
      "slug": "footwear",
      "parent_id": "fashion_apparel",
      "level": 2
    },
    {
      "category_id": "fashion_apparel.footwear.athletic_shoes",
      "name": "Athletic Shoes",
      "slug": "athletic_shoes",
      "parent_id": "fashion_apparel.footwear",
      "level": 3
    },
    {
      "category_id": "fashion_apparel.handbags_purses",
      "name": "Handbags & Purses",
      "slug": "handbags_purses",
      "parent_id": "fashion_apparel",
      "level": 2
    },
    {
      "category_id": "fashion_apparel.jewelry",
      "name": "Jewelry",
      "slug": "jewelry",
      "parent_id": "fashion_apparel",
      "level": 2
    },
    {
      "category_id": "fashion_apparel.jewelry.watches_watch_accessories",
      "name": "Watches & Watch Accessories",
      "slug": "watches_watch_accessories",
      "parent_id": "fashion_apparel.jewelry",
      "level": 3
    },
    {
      "category_id": "fashion_apparel.sunglasses",
      "name": "Sunglasses",
      "slug": "sunglasses",
      "parent_id": "fashion_apparel",
      "level": 2
    },
    {
      "category_id": "arts_entertainment",
      "name": "Arts & Entertainment",
      "slug": "arts_entertainment",
      "parent_id": null,
      "level": 1
    },
    {
      "category_id": "arts_entertainment.arts_entertainment_awards",
      "name": "Arts & Entertainment Awards",
      "slug": "arts_entertainment_awards",
      "parent_id": "arts_entertainment",
      "level": 2
    },
    {
      "category_id": "arts_entertainment.entertainment_industry",
      "name": "Entertainment Industry",
      "slug": "entertainment_industry",
      "parent_id": "arts_entertainment",
      "level": 2
    },
    {
      "category_id": "arts_entertainment.entertainment_industry.film_tv_industry",
      "name": "Film & TV Industry",
      "slug": "film_tv_industry",
      "parent_id": "arts_entertainment.entertainment_industry",
      "level": 3
    },
    {
      "category_id": "arts_entertainment.events_shows_cultural_attractions",
      "name": "Events, Shows & Cultural Attractions",
      "slug": "events_shows_cultural_attractions",
      "parent_id": "arts_entertainment",
      "level": 2
    },
    {
      "category_id": "arts_entertainment.events_shows_cultural_attractions.ticket_sales_exchanges",
      "name": "Ticket Sales & Exchanges",
      "slug": "ticket_sales_exchanges",
      "parent_id": "arts_entertainment.events_shows_cultural_attractions",
      "level": 3
    },
    {
      "category_id": "arts_entertainment.fantasy_sports",
      "name": "Fantasy Sports",
      "slug": "fantasy_sports",
      "parent_id": "arts_entertainment",
      "level": 2
    },
    {
      "category_id": "arts_entertainment.fun_trivia",
      "name": "Fun & Trivia",
      "slug": "fun_trivia",
      "parent_id": "arts_entertainment",
      "level": 2
    },
    {
      "category_id": "arts_entertainment.fun_trivia.fun_tests_silly_surveys",
      "name": "Fun Tests & Silly Surveys",
      "slug": "fun_tests_silly_surveys",
      "parent_id": "arts_entertainment.fun_trivia",
      "level": 3
    },
    {
      "category_id": "arts_entertainment.humor_jokes",
      "name": "Humor & Jokes",
      "slug": "humor_jokes",
      "parent_id": "arts_entertainment",
      "level": 2
    },
    {
      "category_id": "arts_entertainment.movies_films",
      "name": "Movies & Films",
      "slug": "movies_films",
      "parent_id": "arts_entertainment",
      "level": 2
    },
    {
      "category_id": "arts_entertainment.movies_films.horror_films",
      "name": "Horror Films",
      "slug": "horror_films",
      "parent_id": "arts_entertainment.movies_films",
      "level": 3
    },
    {
      "category_id": "arts_entertainment.music_audio",
      "name": "Music & Audio",
      "slug": "music_audio",
      "parent_id": "arts_entertainment",
      "level": 2
    },
    {
      "category_id": "arts_entertainment.music_audio.music_streams_downloads",
      "name": "Music Streams & Downloads",
      "slug": "music_streams_downloads",
      "parent_id": "arts_entertainment.music_audio",
      "level": 3
    },
    {
      "category_id": "arts_entertainment.music_audio.radio",
      "name": "Radio",
      "slug": "radio",
      "parent_id": "arts_entertainment.music_audio",
      "level": 3
    },
    {
      "category_id": "arts_entertainment.offbeat",
      "name": "Offbeat",
      "slug": "offbeat",
      "parent_id": "arts_entertainment",
      "level": 2
    },
    {
      "category_id": "arts_entertainment.offbeat.edgy_bizarre",
      "name": "Edgy & Bizarre",
      "slug": "edgy_bizarre",
      "parent_id": "arts_entertainment.offbeat",
      "level": 3
    },
    {
      "category_id": "arts_entertainment.sports_event_tickets_ticketing_services",
      "name": "Sports Event Tickets & Ticketing Services",
      "slug": "sports_event_tickets_ticketing_services",
      "parent_id": "arts_entertainment",
      "level": 2
    },
    {
      "category_id": "arts_entertainment.tv_video",
      "name": "TV & Video",
      "slug": "tv_video",
      "parent_id": "arts_entertainment",
      "level": 2
    },
    {
      "category_id": "arts_entertainment.tv_video.tv_broadcasting",
      "name": "TV Broadcasting",
      "slug": "tv_broadcasting",
      "parent_id": "arts_entertainment.tv_video",
      "level": 3
    },
    {
      "category_id": "arts_entertainment.tv_video.tv_shows_programs",
      "name": "TV Shows & Programs",
      "slug": "tv_shows_programs",
      "parent_id": "arts_entertainment.tv_video",
      "level": 3
    },
    {
      "category_id": "arts_entertainment.tv_video.tv_shows_programs.tv_cartoons",
      "name": "TV Cartoons",
      "slug": "tv_cartoons",
      "parent_id": "arts_entertainment.tv_video.tv_shows_programs",
      "level": 4
    },
    {
      "category_id": "arts_entertainment.visual_art_design",
      "name": "Visual Art & Design",
      "slug": "visual_art_design",
      "parent_id": "arts_entertainment",
      "level": 2
    },
    {
      "category_id": "arts_entertainment.adult_entertainment",
      "name": "Adult Entertainment",
      "slug": "adult_entertainment",
      "parent_id": "arts_entertainment",
      "level": 2
    },
    {
      "category_id": "arts_entertainment.short_drama",
      "name": "Short Drama",
      "slug": "short_drama",
      "parent_id": "arts_entertainment",
      "level": 2
    },
    {
      "category_id": "arts_entertainment.igaming",
      "name": "iGaming",
      "slug": "igaming",
      "parent_id": "arts_entertainment",
      "level": 2
    },
    {
      "category_id": "automotive",
      "name": "Autos & Vehicles",
      "slug": "automotive",
      "parent_id": null,
      "level": 1
    },
    {
      "category_id": "automotive.boats_watercraft",
      "name": "Boats & Watercraft",
      "slug": "boats_watercraft",
      "parent_id": "automotive",
      "level": 2
    },
    {
      "category_id": "automotive.driving_instruction_driver_education",
      "name": "Driving Instruction & Driver Education",
      "slug": "driving_instruction_driver_education",
      "parent_id": "automotive",
      "level": 2
    },
    {
      "category_id": "automotive.motor_vehicles",